{
  "schema_version": "0.3-draft",
  "request_id": "example-more-evidence",
  "status": "ok",
  "source_id": "example-evidence-source",
  "snapshot_id": "example-evidence-snapshot",
  "url": "https://docs.example.com/guide",
  "final_url": "https://docs.example.com/guide",
  "title": "Constructed evidence snapshot",
  "fetched_at": "2026-09-08T00:00:00Z",
  "content_type": "text/plain",
  "content": "More tools provide structuredContent for consumers.\n",
  "content_sha256": "399fdab436cb9f176d155026863275cb2cbdaa0f10d7fd4e5db7bb8e69e508cb",
  "segments": [
    {
      "id": "example-evidence-2",
      "text": "More tools provide structuredContent for consumers.\n",
      "start_char": 71,
      "end_char": 123
    }
  ],
  "truncated": false,
  "next_cursor": null,
  "warnings": [],
  "error": null,
  "view": "evidence",
  "source_metadata": {
    "source_url": "https://docs.example.com/guide",
    "final_url": "https://docs.example.com/guide",
    "canonical_url": "https://docs.example.com/guide",
    "hostname": "docs.example.com",
    "domain": "example.com",
    "origin": "https://docs.example.com",
    "display_url": "docs.example.com/guide",
    "site_name": "Example Research",
    "description": "Constructed website metadata for frontend rendering.",
    "language": "en",
    "favicon_url": "https://docs.example.com/icon.svg",
    "logo_url": "https://cdn.example.com/logo.png",
    "image_url": "https://cdn.example.com/article-card.png",
    "published_at": null,
    "modified_at": null,
    "retrieved_at": "2026-09-08T00:00:00Z",
    "metadata_source": "html",
    "metadata_url": "https://docs.example.com/guide",
    "assets_verified": false,
    "provenance": {
      "site_name": "opengraph",
      "favicon_url": "html_link",
      "logo_url": "json_ld",
      "image_url": "opengraph",
      "canonical_url": "html_link"
    }
  },
  "evidence": [
    {
      "id": "example-evidence-2",
      "quote": "More tools provide structuredContent for consumers.\n",
      "url": "https://docs.example.com/guide",
      "snapshot_id": "example-evidence-snapshot",
      "snapshot_format": "text",
      "content_sha256": "399fdab436cb9f176d155026863275cb2cbdaa0f10d7fd4e5db7bb8e69e508cb",
      "segment_id": "example-evidence-segment-2",
      "start_char": 71,
      "end_char": 123,
      "fetched_at": "2026-09-08T00:00:00Z",
      "expires_at": "2026-09-09T00:00:00Z",
      "extractor_version": "illustrative-text-v1",
      "snapshot_cursor": "EXAMPLE_EVIDENCE_SNAPSHOT_CURSOR",
      "verification": "exact_match",
      "relevance": {
        "score": 0.6666666666666666,
        "method": "lexical_coverage_v1",
        "version": "lexical_coverage_v1:illustrative",
        "basis": "quote",
        "matched_terms": ["tools", "structuredcontent"],
        "reasons": ["Constructed token coverage example; not a probability."]
      },
      "segment_ids": ["example-evidence-segment-2"],
      "selection_method": "paragraph_context_v2"
    }
  ],
  "has_more_evidence": false,
  "next_evidence_cursor": null,
  "evidence_chars": 52
}
